Name,Age
Mr. Owen Harris Braund,22
Mrs. John Bradley (Florence Briggs Thayer) Cumings,38
Miss. Laina Heikkinen,26
Mrs. Jacques Heath (Lily May Peel) Futrelle,35
Mr. William Henry Allen,35
Mr. James Moran,27
Mr. Timothy J McCarthy,54
Master. Gosta Leonard Palsson,2
Mrs. Oscar W (Elisabeth Vilhelmina Berg) Johnson,27
Mrs. Nicholas (Adele Achem) Nasser,14
Miss. Marguerite Rut Sandstrom,4
Miss. Elizabeth Bonnell,58
Mr. William Henry Saundercock,20
Mr. Anders Johan Andersson,39
Miss. Hulda Amanda Adolfina Vestrom,14
Mrs. (Mary D Kingcome) Hewlett,55
Master. Eugene Rice,2
Mr. Charles Eugene Williams,23
Mrs. Julius (Emelia Maria Vandemoortele) Vander Planke,31
Mrs. Fatima Masselmani,22
Mr. Joseph J Fynney,35
Mr. Lawrence Beesley,34
Miss. Anna McGowan,15
Mr. William Thompson Sloper,28
Miss. Torborg Danira Palsson,8
Mrs. Carl Oscar (Selma Augusta Emilia Johansson) Asplund,38
Mr. Farred Chehab Emir,26
Mr. Charles Alexander Fortune,19
Miss. Ellen O'Dwyer,24
Mr. Lalio Todoroff,23
Don. Manuel E Uruchurtu,40
Mrs. William Augustus (Marie Eugenie) Spencer,48
Miss. Mary Agatha Glynn,18
Mr. Edward H Wheadon,66
Mr. Edgar Joseph Meyer,28
Mr. Alexander Oskar Holverson,42
Mr. Hanna Mamee,18
Mr. Ernest Charles Cann,21
Miss. Augusta Maria Vander Planke,18
Miss. Jamila Nicola-Yarred,14
Mrs. Johan (Johanna Persdotter Larsson) Ahlin,40
Mrs. William John Robert (Dorothy Ann Wonnacott) Turpin,27
Miss. Simonne Marie Anne Andree Laroche,3
Miss. Margaret Delia Devaney,19
Mr. William John Rogers,30
Mr. Denis Lennon,20
Miss. Bridget O'Driscoll,27
Mr. Youssef Samaan,16
Mrs. Josef (Josefine Franchi) Arnold-Franchi,18
Master. Juha Niilo Panula,7
Mr. Richard Cater Nosworthy,21
Mrs. Henry Sleeper (Myna Haxtun) Harper,49
Mrs. Lizzie (Elizabeth Anne Wilkinson) Faunthorpe,29
Mr. Engelhart Cornelius Ostby,65
Mr. Hugh Woolner,46
Miss. Emily Rugg,21
Mr. Mansouer Novel,28.5
Miss. Constance Mirium West,5
Master. William Frederick Goodwin,11
Mr. Orsen Sirayanian,22
Miss. Amelie Icard,38
Mr. Henry Birkhardt Harris,45
Master. Harald Skoog,4
Mr. Albert A Stewart,64
Master. Gerios Moubarek,7
Mrs. (Elizabeth Ramell) Nye,29
Mr. Ernest James Crease,19
Miss. Erna Alexandra Andersson,17
Mr. Vincenz Kink,26
Mr. Stephen Curnow Jenkin,32
Miss. Lillian Amy Goodwin,16
Mr. Ambrose Jr Hood,21
Mr. Apostolos Chronopoulos,26
Mr. Lee Bing,32
Mr. Sigurd Hansen Moen,25
Mr. Ivan Staneff,23
Mr. Rahamin Haim Moutal,28
Master. Alden Gates Caldwell,0.83
Miss. Elizabeth Dowdell,30
Mr. Achille Waelens,22
Mr. Jan Baptist Sheerlinck,29
Miss. Brigdet Delia McDermott,31
Mr. Francisco M Carrau,28
Miss. Bertha Ilett,17
Mrs. Karl Alfred (Maria Mathilda Gustafsson) Backstrom,33
Mr. William Neal Ford,16
Mr. Selman Francis Slocovski,20
Miss. Mabel Helen Fortune,23
Mr. Francesco Celotti,24
Mr. Emil Christmann,29
Mr. Paul Edvin Andreasson,20
Mr. Herbert Fuller Chaffee,46
Mr. Bertram Frank Dean,26
Mr. Daniel Coxon,59
Mr. Charles Joseph Shorney,22
Mr. George B Goldschmidt,71
Mr. William Bertram Greenfield,23
Mrs. John T (Ada Julia Bone) Doling,34
Mr. Sinai Kantor,34
Miss. Matilda Petranec,28
Mr. Pastcho Petroff,29
Mr. Richard Frasar White,21
Mr. Gustaf Joel Johansson,33
Mr. Anders Vilhelm Gustafsson,37
Mr. Stoytcho Mionoff,28
Miss. Anna Kristine Salkjelsvik,21
Mr. Albert Johan Moss,29
Mr. Tido Rekic,38
Miss. Bertha Moran,28
Mr. Walter Chamberlain Porter,47
Miss. Hileni Zabour,14.5
Mr. David John Barton,22
Miss. Katriina Jussila,20
Miss. Malake Attalah,17
Mr. Edvard Pekoniemi,21
Mr. Patrick Connors,70.5
Mr. William John Robert Turpin,29
Mr. Quigg Edmond Baxter,24
Miss. Ellis Anna Maria Andersson,2
Mr. Stanley George Hickman,21
Mr. Leonard Charles Moore,19
Mr. Nicholas Nasser,32.5
Miss. Susan Webber,32.5
Mr. Percival Wayland White,54
Master. Elias Nicola-Yarred,12
Mr. Martin McMahon,19
Mr. Fridtjof Arne Madsen,24
Miss. Anna Peter,2
Mr. Johan Ekstrom,45
Mr. Jozef Drazenoic,33
Mr. Domingos Fernandeo Coelho,20
Mrs. Alexander A (Grace Charity Laury) Robins,47
Mrs. Leopold (Mathilde Francoise Pede) Weisz,29
Mr. Samuel James Hayden Sobey,25
Mr. Emile Richard,23
Miss. Helen Monypeny Newsom,19
Mr. Jacques Heath Futrelle,37
Mr. Olaf Elon Osen,16
Mr. Victor Giglio,24
Mrs. Joseph (Sultana) Boulos,40
Miss. Anna Sofia Nysten,22
Mrs. Pekka Pietari (Elin Matilda Dolck) Hakkarainen,24
Mr. Jeremiah Burke,19
Mr. Edgardo Samuel Andrew,18
Mr. Joseph Charles Nicholls,19
Mr. August Edvard Andersson,27
Miss. Robina Maggie Ford,9
Mr. Michel Navratil,36.5
Rev. Thomas Roussel Davids Byles,42
Rev. Robert James Bateman,51
Mrs. Thomas (Edith Wearne) Pears,22
Mr. Alfonzo Meo,55.5
Mr. Austin Blyler van Billiard,40.5
Mr. Ole Martin Olsen,27
Mr. Charles Duane Williams,51
Miss. Katherine Gilnagh,16
Mr. Harry Corn,30
Mr. Mile Smiljanic,37
Master. Thomas Henry Sage,5
Mr. John Hatfield Cribb,44
Mrs. James (Elizabeth Inglis Milne) Watt,40
Mr. John Viktor Bengtsson,26
Mr. Jovo Calic,17
Master. Eino Viljami Panula,1
Master. Frank John William Goldsmith,9
Mrs. (Edith Martha Bowerman) Chibnall,48
Mrs. William (Anna Bernhardina Karlsson) Skoog,45
Mr. John D Baumann,60
Mr. Lee Ling,28
Mr. Wyckoff Van der hoef,61
Master. Arthur Rice,4
Miss. Eleanor Ileen Johnson,1
Mr. Antti Wilhelm Sivola,21
Mr. James Clinch Smith,56
Mr. Klas Albin Klasen,18
Master. Henry Forbes Lefebre,5
Miss. Ann Elizabeth Isham,50
Mr. Reginald Hale,30
Mr. Lionel Leonard,36
Miss. Constance Gladys Sage,8
Mr. Rene Pernot,39
Master. Clarence Gustaf Hugo Asplund,9
Master. Richard F Becker,1
Miss. Luise Gretchen Kink-Heilmann,4
Mr. Hugh Roscoe Rood,39
Mrs. Thomas (Johanna Godfrey) O'Brien,26
Mr. Charles Hallace Romaine,45
Mr. John Bourke,40
Mr. Stjepan Turcin,36
Mrs. (Rosa) Pinsky,32
Mr. William Carbines,19
Miss. Carla Christine Nielsine Andersen-Jensen,19
Master. Michel M Navratil,3
Mrs. James Joseph (Margaret Tobin) Brown,44
Miss. Elise Lurette,58
Mr. Robert Mernagh,28
Mr. Karl Siegwart Andreas Olsen,42
Miss. Margaret Madigan,21
Miss. Henriette Yrois,24
Mr. Nestor Cyriel Vande Walle,28
Mr. Frederick Sage,17
Mr. Jakob Alfred Johanson,34
Mr. Gerious Youseff,45.5
Mr. Gurshon Cohen,18
Miss. Telma Matilda Strom,2
Mr. Karl Alfred Backstrom,32
Mr. Nassef Cassem Albimona,26
Miss. Helen Carr,16
Mr. Henry Blank,40
Mr. Ahmed Ali,24
Miss. Clear Annie Cameron,35
Mr. John Henry Perkin,22
Mr. Hans Kristensen Givard,30
Mr. Philip Kiernan,22
Miss. Madeleine Newell,31
Miss. Eliina Honkanen,27
Mr. Sidney Samuel Jacobsohn,42
Miss. Albina Bazzani,32
Mr. Walter Harris,30
Mr. Victor Francis Sunderland,16
Mr. James H Bracken,27
Mr. George Henry Green,51
Mr. Christo Nenkoff,22
Mr. Frederick Maxfield Hoyt,38
Mr. Karl Ivar Sven Berglund,22
Mr. William John Mellors,19
Mr. John Hall Lovell,20.5
Mr. Arne Jonas Fahlstrom,18
Miss. Mathilde Lefebre,12
Mrs. Henry Birkhardt (Irene Wallach) Harris,35
Mr. Bengt Edvin Larsson,29
Mr. Ernst Adolf Sjostedt,59
Miss. Lillian Gertrud Asplund,5
Mr. Robert William Norman Leyson,24
Miss. Alice Phoebe Harknett,21
Mr. Stephen Hold,44
Miss. Marjorie Collyer,8
Mr. Frederick William Pengelly,19
Mr. George Henry Hunt,33
Miss. Thamine Zabour,19
Miss. Katherine Murphy,18
Mr. Reginald Charles Coleridge,29
Mr. Matti Alexanteri Maenpaa,22
Mr. Sleiman Attalah,30
Dr. William Edward Minahan,44
Miss. Agda Thorilda Viktoria Lindahl,25
Mrs. William (Anna) Hamalainen,24
Mr. Richard Leonard Beckwith,37
Rev. Ernest Courtenay Carter,54
Mr. James George Reed,18
Mrs. Wilhelm (Elna Matilda Persson) Strom,29
Mr. William Thomas Stead,62
Mr. William Arthur Lobb,30
Mrs. Viktor (Helena Wilhelmina) Rosblom,41
Mrs. Darwis (Hanne Youssef Razi) Touma,29
Mrs. Gertrude Maybelle Thorne,38
Miss. Gladys Cherry,30
Miss. Anna Ward,35
Mrs. (Lutie Davis) Parrish,50
Master. Edvin Rojj Felix Asplund,3
Mr. Emil Taussig,52
Mr. William Harrison,40
Miss. Delia Henry,21
Mr. David Reeves,36
Mr. Ernesti Arvid Panula,16
Mr. Ernst Ulrik Persson,25
Mrs. William Thompson (Edith Junkins) Graham,58
Miss. Amelia Bissette,35
Mr. Alexander Cairns,28
Mr. William Henry Tornquist,25
Mrs. (Elizabeth Anne Maidment) Mellinger,41
Mr. Charles H Natsch,37
Miss. Hanora Healy,33
Miss. Kornelia Theodosia Andrews,63
Miss. Augusta Charlotta Lindblom,45
Mr. Francis Parkes,21
Master. Eric Rice,7
Mrs. Stanton (Rosa Hunt) Abbott,35
Mr. Frank Duane,65
Mr. Nils Johan Goransson Olsson,28
Mr. Alfons de Pelsmaeker,16
Mr. Edward Arthur Dorking,19
Mr. Richard William Smith,57
Mr. Ivan Stankovic,33
Mr. Theodore de Mulder,30
Mr. Penko Naidenoff,22
Mr. Masabumi Hosono,42
Miss. Kate Connolly,22
Miss. Ellen Barber,26
Mrs. Dickinson H (Helen Walton) Bishop,19
Mr. Rene Jacques Levy,36
Miss. Aloisia Haas,24
Mr. Ivan Mineff,24
Mr. Ervin G Lewy,30
Mr. Mansour Hanna,23.5
Miss. Helen Loraine Allison,2
Mr. Adolphe Saalfeld,47
Mrs. James (Helene DeLaudeniere Chaput) Baxter,50
Miss. Anna Katherine Kelly,20
Mr. Bernard McCoy,24
Mr. William Cahoone Jr Johnson,19
Miss. Nora A Keane,46
Mr. Howard Hugh Williams,28
Master. Hudson Trevor Allison,0.92
Miss. Margaret Fleming,42
Mrs. Victor de Satode (Maria Josefa Perez de Soto y Vallejo) Penasco y Castellana,17
Mr. Samuel Abelson,30
Miss. Laura Mabel Francatelli,30
Miss. Margaret Bechstein Hays,24
Miss. Emily Borie Ryerson,18
Mrs. William (Anna Sylfven) Lahtinen,26
Mr. Ignjac Hendekovic,28
Mr. Benjamin Hart,43
Miss. Helmina Josefina Nilsson,26
Mrs. Sinai (Miriam Sternin) Kantor,24
Dr. Ernest Moraweck,54
Miss. Mary Natalie Wick,31
Mrs. Frederic Oakley (Margaretta Corning Stone) Spedden,40
Mr. Samuel Dennis,22
Mr. Yoto Danoff,27
Miss. Hilda Mary Slayter,30
Mrs. Albert Francis (Sylvia Mae Harbaugh) Caldwell,22
Mr. George John Jr Sage,20
Miss. Marie Grice Young,36
Mr. Johan Hansen Nysveen,61
Mrs. (Ada E Hall) Ball,36
Mrs. Frank John (Emily Alice Brown) Goldsmith,31
Miss. Jean Gertrude Hippach,16
Miss. Agnes McCoy,28
Mr. Austen Partner,45.5
Mr. George Edward Graham,38
Mr. Leo Edmondus Vander Planke,16
Mrs. Henry William (Clara Heinsheimer) Frauenthal,42
Mr. Mitto Denkoff,30
Mr. Thomas Clinton Pears,29
Miss. Elizabeth Margaret Burns,41
Mr. Karl Edwart Dahl,45
Mr. Stephen Weart Blackwell,45
Master. Edmond Roger Navratil,2
Miss. Alice Elizabeth Fortune,24
Mr. Erik Gustaf Collander,28
Mr. Charles Frederick Waddington Sedgwick,25
Mr. Stanley Hubert Fox,36
Miss. Amelia Brown,24
Miss. Marion Elsie Smith,40
Mrs. Thomas Henry (Mary E Finck) Davison,34
Master. William Loch Coutts,3
Mr. Jovan Dimic,42
Mr. Nils Martin Odahl,23
Mr. Fletcher Fellows Williams-Lambert,43
Mr. Tannous Elias,15
Mr. Josef Arnold-Franchi,25
Mr. Wazli Yousif,23
Mr. Leo Peter Vanden Steen,28
Miss. Elsie Edith Bowerman,22
Miss. Annie Clemmer Funk,38
Miss. Mary McGovern,22
Miss. Helen Mary Mockler,23
Mr. Wilhelm Skoog,40
Mr. Sebastiano del Carlo,29
Mrs. (Catherine David) Barbara,45
Mr. Adola Asim,35
Mr. Thomas O'Brien,27
Mr. Mauritz Nils Martin Adahl,30
Mrs. Frank Manley (Anna Sophia Atkinson) Warren,60
Mrs. (Mantoura Boulos) Moussa,35
Miss. Annie Jermyn,22
Mme. Leontine Pauline Aubart,24
Mr. George Achilles Harder,25
Mr. Jakob Alfred Wiklund,18
Mr. William Thomas Beavan,19
Mr. Sante Ringhini,22
Miss. Stina Viola Palsson,3
Mrs. Edgar Joseph (Leila Saks) Meyer,25
Miss. Aurora Adelia Landergren,22
Mr. Harry Elkins Widener,27
Mr. Tannous Betros,20
Mr. Karl Gideon Gustafsson,19
Miss. Rosalie Bidois,42
Miss. Maria Nakid,1
Mr. Juho Tikkanen,32
Mrs. Alexander Oskar (Mary Aline Towner) Holverson,35
Mr. Vasil Plotcharsky,27
Mr. Charles Henry Davies,18
Master. Sidney Leonard Goodwin,1
Miss. Kate Buss,36
Mr. Matthew Sadlier,19
Miss. Bertha Lehmann,17
Mr. William Ernest Carter,36
Mr. Carl Olof Jansson,21
Mr. Johan Birger Gustafsson,28
Miss. Marjorie Newell,23
Mrs. Hjalmar (Agnes Charlotta Bengtsson) Sandstrom,24
Mr. Erik Johansson,22
Miss. Elina Olsson,31
Mr. Peter David McKane,46
Dr. Alfred Pain,23
Mrs. William H (Jessie L) Trout,28
Mr. Juha Niskanen,39
Mr. John Adams,26
Miss. Mari Aina Jussila,21
Mr. Pekka Pietari Hakkarainen,28
Miss. Marija Oreskovic,20
Mr. Shadrach Gale,34
Mr. Carl/Charles Peter Widegren,51
Master. William Rowe Richards,3
Mr. Hans Martin Monsen Birkeland,21
Miss. Ida Lefebre,3
Mr. Todor Sdycoff,42
Mr. Henry Hart,27
Miss. Daisy E Minahan,33
Mr. Alfred Fleming Cunningham,22
Mr. Johan Julian Sundman,44
Mrs. Thomas (Annie Louise Rowley) Meek,32
Mrs. James Vivian (Lulu Thorne Christian) Drew,34
Miss. Lyyli Karoliina Silven,18
Mr. William John Matthews,30
Miss. Catharina Van Impe,10
Mr. David Charters,21
Mr. Leo Zimmerman,29
Mrs. Ernst Gilbert (Anna Sigrid Maria Brogren) Danbom,28
Mr. Viktor Richard Rosblom,18
Mr. Phillippe Wiseman,54
Mrs. Charles V (Ada Maria Winfield) Clarke,28
Miss. Kate Florence Phillips,19
Mr. James Flynn,28
Mr. Berk (Berk Trembisky) Pickard,32
Mr. Mauritz Hakan Bjornstrom-Steffansson,28
Mrs. Percival (Florence Kate White) Thorneycroft,33
Mrs. Charles Alexander (Alice Adelaide Slow) Louch,42
Mr. Nikolai Erland Kallio,17
Mr. William Baird Silvey,50
Miss. Lucile Polk Carter,14
Miss. Doolina Margaret Ford,21
Mrs. Sidney (Emily Hocking) Richards,24
Mr. Mark Fortune,64
Mr. Johan Henrik Johannesson Kvillner,31
Mrs. Benjamin (Esther Ada Bloomfield) Hart,45
Mr. Leon Hampe,20
Mr. Johan Emil Petterson,25
Ms. Encarnacion Reynaldo,28
Mr. Bernt Johannesen-Bratthammer,29
Master. Washington Dodge,4
Miss. Madeleine Violet Mellinger,13
Mr. Frederic Kimber Seward,34
Miss. Marie Catherine Baclini,5
Major. Arthur Godfrey Peuchen,52
Mr. Edwy Arthur West,36
Mr. Ingvald Olai Olsen Hagland,28
Mr. Benjamin Laventall Foreman,30
Mr. Samuel L Goldenberg,49
Mr. Joseph Peduzzi,24
Mr. Ivan Jalsevac,29
Mr. Francis Davis Millet,65
Mrs. Frederick R (Marion) Kenyon,41
Miss. Ellen Toomey,50
Mr. Maurice O'Connor,17
Mr. Harry Anderson,48
Mr. William Morley,34
Mr. Arthur H Gee,47
Mr. Jacob Christian Milling,48
Mr. Simon Maisner,34
Mr. Manuel Estanslas Goncalves,38
Mr. William Campbell,21
Mr. John Montgomery Smart,56
Mr. James Scanlan,22
Miss. Helene Barbara Baclini,0.75
Mr. Arthur Keefe,39
Mr. Luka Cacic,38
Mrs. Edwy Arthur (Ada Mary Worth) West,33
Mrs. Amin S (Marie Marthe Thuillard) Jerwan,23
Miss. Ida Sofia Strandberg,22
Mr. George Quincy Clifford,40
Mr. Peter Henry Renouf,34
Mr. Lewis Richard Braund,29
Mr. Nils August Karlsson,22
Miss. Hildur E Hirvonen,2
Master. Harold Victor Goodwin,9
Mr. Anthony Wood Frost,37
Mr. Richard Henry Rouse,50
Mrs. (Hedwig) Turkula,63
Mr. Dickinson H Bishop,25
Miss. Jeannie Lefebre,8
Mrs. Frederick Maxfield (Jane Anne Forby) Hoyt,35
Mr. Edward Austin Kent,58
Mr. Francis William Somerton,30
Master. Eden Leslie Coutts,9
Mr. Konrad Mathias Reiersen Hagland,19
Mr. Einar Windelov,21
Mr. Harry Markland Molson,55
Mr. Ramon Artagaveytia,71
Mr. Edward Roland Stanley,21
Mr. Gerious Yousseff,26
Miss. Elizabeth Mussey Eustis,54
Mr. Frederick William Shellard,55
Mrs. Hudson J C (Bessie Waldo Daniels) Allison,25
Mr. Olof Svensson,24
Mr. Petar Calic,17
Miss. Mary Canavan,21
Miss. Bridget Mary O'Sullivan,21
Miss. Kristina Sofia Laitinen,37
Miss. Roberta Maioni,16
Mr. Victor de Satode Penasco y Castellana,18
Mrs. Frederick Charles (Jane Richards) Quick,33
Mr. George Bradley,37
Mr. Henry Margido Olsen,28
Mr. Fang Lang,26
Mr. Eugene Patrick Daly,29
Mr. James Webber,66
Mr. James Robert McGough,36
Mrs. Martin (Elizabeth L. Barrett) Rothschild,54
Mr. Satio Coleff,24
Mr. William Anderson Walker,47
Mrs. (Amelia Milley) Lemore,34
Mr. Patrick Ryan,30
Mrs. William A (Florence Agnes Hughes) Angle,36
Mr. Stefo Pavlovic,32
Miss. Anne Perreault,30
Mr. Janko Vovk,22
Mr. Sarkis Lahoud,35
Mrs. Louis Albert (Ida Sophia Fischer) Hippach,44
Mr. Fared Kassem,18
Mr. James Farrell,40.5
Miss. Lucy Ridsdale,50
Mr. John Farthing,49
Mr. Johan Werner Salonen,39
Mr. Richard George Hocking,23
Miss. Phyllis May Quick,2
Mr. Nakli Toufik,17
Mr. Joseph Jr Elias,17
Mrs. Catherine (Catherine Rizk) Peter,24
Miss. Marija Cacic,30
Miss. Eva Miriam Hart,7
Major. Archibald Willingham Butt,45
Miss. Bertha LeRoy,30
Mr. Samuel Beard Risien,69
Miss. Hedwig Margaritha Frolicher,22
Miss. Harriet R Crosby,36
Miss. Ingeborg Constanzia Andersson,9
Miss. Sigrid Elisabeth Andersson,11
Mr. Edward Beane,32
Mr. Walter Donald Douglas,50
Mr. Arthur Ernest Nicholson,64
Mrs. Edward (Ethel Clarke) Beane,19
Mr. Julian Padro y Manent,27
Mr. Frank John Goldsmith,33
Master. John Morgan Jr Davies,8
Mr. John Borland Jr Thayer,17
Mr. Percival James R Sharp,27
Mr. Timothy O'Brien,21
Mr. Fahim Leeni,22
Miss. Velin Ohman,22
Mr. George Wright,62
Lady. (Lucille Christiana Sutherland)Duff Gordon,48
Mr. Victor Robbins,45
Mrs. Emil (Tillie Mandelbaum) Taussig,39
Mrs. Guillaume Joseph (Emma) de Messemaeker,36
Mr. Thomas Rowan Morrow,30
Mr. Husein Sivic,40
Mr. Robert Douglas Norman,28
Mr. John Simmons,40
Miss. (Marion Ogden) Meanwell,62
Mr. Alfred J Davies,24
Mr. Ilia Stoytcheff,19
Mrs. Nils (Alma Cornelia Berglund) Palsson,29
Mr. Tannous Doharr,28
Mr. Carl Jonsson,32
Mr. George Harris,62
Mrs. Edward Dale (Charlotte Lamson) Appleton,53
Mr. John Irwin Flynn,36
Miss. Mary Kelly,22
Mr. Alfred George John Rush,16
Mr. George Patchett,19
Miss. Ethel Garside,34
Mrs. William Baird (Alice Munger) Silvey,39
Mrs. Joseph (Maria Elias) Caram,18
Mr. Eiriik Jussila,32
Miss. Julie Rachel Christy,25
Mrs. John Borland (Marian Longstreth Morris) Thayer,39
Mr. William James Downton,54
Mr. John Hugo Ross,36
Mr. Uscher Paulner,16
Miss. Ruth Taussig,18
Mr. John Denzil Jarvis,47
Mr. Maxmillian Frolicher-Stehli,60
Mr. Eliezer Gilinski,22
Mr. Joseph Murdlin,22
Mr. Matti Rintamaki,35
Mrs. Walter Bertram (Martha Eustis) Stephenson,52
Mr. William James Elsbury,47
Miss. Mary Bourke,40
Mr. John Henry Chapman,37
Mr. Jean Baptiste Van Impe,36
Miss. Jessie Wills Leitch,31
Mr. Alfred Johnson,49
Mr. Hanna Boulos,18
Sir. Cosmo Edmund Duff Gordon,49
Mrs. Sidney Samuel (Amy Frances Christy) Jacobsohn,24
Mr. Petco Slabenoff,42
Mr. Charles H Harrington,37
Mr. Ernst William Torber,44
Mr. Harry Homer,35
Mr. Edvard Bengtsson Lindell,36
Mr. Milan Karaic,30
Mr. Robert Williams Daniel,27
Mrs. Joseph (Juliette Marie Louise Lafargue) Laroche,22
Miss. Elizabeth W Shutes,40
Mrs. Anders Johan (Alfrida Konstantia Brogren) Andersson,39
Mr. Jose Neto Jardin,21
Miss. Margaret Jane Murphy,18
Mr. John Horgan,22
Mr. William Alfred Brocklebank,35
Miss. Alice Herman,24
Mr. Ernst Gilbert Danbom,34
Mrs. William Arthur (Cordelia K Stanlick) Lobb,26
Miss. Marion Louise Becker,4
Mr. Lawrence Gavey,26
Mr. Antoni Yasbeck,27
Mr. Edwin Nelson Jr Kimball,42
Mr. Sahid Nakid,20
Mr. Henry Damsgaard Hansen,21
Mr. David John Bowen,21
Mr. Frederick Sutton,61
Rev. Charles Leonard Kirkland,57
Miss. Gretchen Fiske Longley,21
Mr. Guentcho Bostandyeff,26
Mr. Patrick D O'Connell,18
Mr. Algernon Henry Wilson Barkworth,80
Mr. Johan Svensson Lundahl,51
Dr. Max Stahelin-Maeglin,32
Mr. William Henry Marsh Parr,30
Miss. Mabel Skoog,9
Miss. Mary Davis,28
Mr. Antti Gustaf Leinonen,32
Mr. Harvey Collyer,31
Mrs. Juha (Maria Emilia Ojala) Panula,41
Mr. Percival Thorneycroft,37
Mr. Hans Peder Jensen,20
Mlle. Emma Sagesser,24
Miss. Margit Elizabeth Skoog,2
Mr. Choong Foo,32
Miss. Eugenie Baclini,0.75
Mr. Henry Sleeper Harper,48
Mr. Liudevit Cor,19
Col. Oberst Alfons Simonius-Blumer,56
Mr. Edward Willey,21
Miss. Amy Zillah Elsie Stanley,23
Mr. Mito Mitkoff,23
Miss. Elsie Doling,18
Mr. Johannes Halvorsen Kalvik,21
Miss. Hanora O'Leary,16
Miss. Hanora Hegarty,18
Mr. Leonard Mark Hickman,24
Mr. Alexander Radeff,27
Mrs. John (Catherine) Bourke,32
Mr. George Floyd Eitemiller,23
Mr. Arthur Webster Newell,58
Dr. Henry William Frauenthal,50
Mr. Mohamed Badt,40
Mr. Edward Pomeroy Colley,47
Mr. Peju Coleff,36
Mr. Eino William Lindqvist,20
Mr. Lewis Hickman,32
Mr. Reginald Fenton Butler,25
Mr. Knud Paust Rommetvedt,49
Mr. Jacob Cook,43
Mrs. Elmer Zebley (Juliet Cummins Wright) Taylor,48
Mrs. Thomas William Solomon (Elizabeth Catherine Ford) Brown,40
Mr. Thornton Davidson,31
Mr. Henry Michael Mitchell,70
Mr. Charles Wilhelms,31
Mr. Ennis Hastings Watson,19
Mr. Gustaf Hjalmar Edvardsson,18
Mr. Frederick Charles Sawyer,24.5
Miss. Anna Sofia Turja,18
Mrs. Frederick (Augusta Tyler) Goodwin,43
Mr. Thomas Drake Martinez Cardeza,36
Miss. Katie Peters,28
Mr. Hammad Hassab,27
Mr. Thor Anderson Olsvigen,20
Mr. Charles Edward Goodwin,14
Mr. Thomas William Solomon Brown,60
Mr. Joseph Philippe Lemercier Laroche,25
Mr. Jaako Arnold Panula,14
Mr. Branko Dakic,19
Mr. Eberhard Thelander Fischer,18
Miss. Georgette Alexandra Madill,15
Mr. Albert Adrian Dick,31
Miss. Manca Karun,4
Mr. Ali Lam,37
Mr. Khalil Saad,25
Col. John Weir,60
Mr. Charles Henry Chapman,52
Mr. James Kelly,44
Miss. Katherine Mullens,19
Mr. John Borland Thayer,49
Mr. Adolf Mathias Nicolai Olsen Humblen,42
Mrs. John Jacob (Madeleine Talmadge Force) Astor,18
Mr. Spencer Victor Silverthorne,35
Miss. Saiide Barbara,18
Mr. Martin Gallagher,25
Mr. Henrik Juul Hansen,26
Mr. Henry Samuel Morley,39
Mrs. Florence Kelly,45
Mr. Edward Pennington Calderhead,42
Miss. Alice Cleaver,22
Master. Halim Gonios Moubarek,4
Mlle. Berthe Antonine Mayne,24
Mr. Herman Klaber,41
Mr. Elmer Zebley Taylor,48
Mr. August Viktor Larsson,29
Mr. Samuel Greenberg,52
Mr. Peter Andreas Lauritz Andersen Soholt,19
Miss. Caroline Louise Endres,38
Miss. Edwina Celia Troutt,27
Mr. Malkolm Joackim Johnson,33
Miss. Annie Jessie Harper,6
Mr. Svend Lauritz Jensen,17
Mr. William Henry Gillespie,34
Mr. Henry Price Hodges,50
Mr. Norman Campbell Chambers,27
Mr. Luka Oreskovic,20
Mrs. Peter Henry (Lillian Jefferys) Renouf,30
Miss. Margareth Mannion,28
Mr. Kurt Arnold Gottfrid Bryhl,25
Miss. Pieta Sofia Ilmakangas,25
Miss. Elisabeth Walton Allen,29
Mr. Houssein G N Hassan,11
Mr. Robert J Knight,41
Mr. William John Berriman,23
Mr. Moses Aaron Troupiansky,23
Mr. Leslie Williams,28.5
Mrs. Edward (Margaret Ann Watson) Ford,48
Mr. Gustave J Lesurer,35
Mr. Kanio Ivanoff,20
Mr. Minko Nankoff,32
Mr. Walter James Hawksford,45
Mr. Tyrell William Cavendish,36
Miss. Susan Parker Ryerson,21
Mr. Neal McNamee,24
Mr. Juho Stranden,31
Capt. Edward Gifford Crosby,70
Mr. Rossmore Edward Abbott,16
Miss. Anna Sinkkonen,30
Mr. Daniel Warner Marvin,19
Mr. Michael Connaghton,31
Miss. Joan Wells,4
Master. Meier Moor,6
Mr. Johannes Joseph Vande Velde,33
Mr. Lalio Jonkoff,23
Mrs. Samuel (Jane Laver) Herman,48
Master. Viljo Hamalainen,0.67
Mr. August Sigfrid Carlsson,28
Mr. Percy Andrew Bailey,18
Mr. Thomas Leonard Theobald,34
the Countess. of (Lucy Noel Martha Dyer-Edwards) Rothes,33
Mr. John Garfirth,23
Mr. Iisakki Antino Aijo Nirva,41
Mr. Hanna Assi Barah,20
Mrs. William Ernest (Lucile Polk) Carter,36
Mr. Hans Linus Eklund,16
Mrs. John C (Anna Andrews) Hogeboom,51
Dr. Arthur Jackson Brewe,46
Miss. Mary Mangan,30.5
Mr. Daniel J Moran,28
Mr. Daniel Danielsen Gronnestad,32
Mr. Rene Aime Lievens,24
Mr. Niels Peder Jensen,48
Mrs. (Mary) Mack,57
Mr. Dibo Elias,29
Mrs. Elizabeth (Eliza Needs) Hocking,54
Mr. Pehr Fabian Oliver Malkolm Myhrman,18
Mr. Roger Tobin,20
Miss. Virginia Ethel Emanuel,5
Mr. Thomas J Kilgannon,22
Mrs. Edward Scott (Elisabeth Walton McMillan) Robert,43
Miss. Banoura Ayoub,13
Mrs. Albert Adrian (Vera Gillespie) Dick,17
Mr. Milton Clyde Long,29
Mr. Andrew G Johnston,35
Mr. William Ali,25
Mr. Abraham (David Lishin) Harmer,25
Miss. Anna Sofia Sjoblom,18
Master. George Hugh Rice,8
Master. Bertram Vere Dean,1
Mr. Benjamin Guggenheim,46
Mr. Andrew Keane,20
Mr. Alfred Gaskell,16
Miss. Stella Anna Sage,21
Mr. William Fisher Hoyt,43
Mr. Ristiu Dantcheff,25
Mr. Richard Otter,39
Dr. Alice (Farnham) Leader,49
Mrs. Mara Osman,31
Mr. Yousseff Ibrahim Shawah,30
Mrs. Jean Baptiste (Rosalie Paula Govaert) Van Impe,30
Mr. Martin Ponesell,34
Mrs. Harvey (Charlotte Annie Tate) Collyer,31
Master. William Thornton II Carter,11
Master. Assad Alexander Thomas,0.42
Mr. Oskar Arvid Hedman,27
Mr. Karl Johan Johansson,31
Mr. Thomas Jr Andrews,39
Miss. Ellen Natalia Pettersson,18
Mr. August Meyer,39
Mrs. Norman Campbell (Bertha Griggs) Chambers,33
Mr. William Alexander,26
Mr. James Lester,39
Mr. Richard James Slemen,35
Miss. Ebba Iris Alfrida Andersson,6
Mr. Ernest Portage Tomlin,30.5
Mr. Richard Fry,39
Miss. Wendla Maria Heininen,23
Mr. Albert Mallet,31
Mr. John Fredrik Alexander Holm,43
Master. Karl Thorsten Skoog,10
Mrs. Charles Melville (Clara Jennings Gregg) Hays,52
Mr. Nikola Lulic,27
Jonkheer. John George Reuchlin,38
Mrs. (Beila) Moor,27
Master. Urho Abraham Panula,2
Mr. John Flynn,36
Mr. Len Lam,23
Master. Andre Mallet,1
Mr. Thomas Joseph McCormack,19
Mrs. George Nelson (Martha Evelyn) Stone,62
Mrs. Antoni (Selini Alexander) Yasbeck,15
Master. George Sibley Richards,0.83
Mr. Amin Saad,30
Mr. Albert Augustsson,23
Mr. Owen George Allum,18
Miss. Sara Rebecca Compton,39
Mr. Jakob Pasic,21
Mr. Maurice Sirota,20
Mr. Chang Chip,32
Mr. Pierre Marechal,29
Mr. Ilmari Rudolf Alhomaki,20
Mr. Thomas Charles Mudd,16
Miss. Augusta Serepeca,30
Mr. Peter L Lemberopolous,34.5
Mr. Jeso Culumovic,17
Mr. Anthony Abbing,42
Mr. Douglas Bullen Sage,18
Mr. Marin Markoff,35
Rev. John Harper,28
Mrs. Samuel L (Edwiga Grabowska) Goldenberg,40
Master. Sigvard Harald Elias Andersson,4
Mr. Johan Svensson,74
Miss. Nourelain Boulos,9
Miss. Mary Conover Lines,16
Mrs. Ernest Courtenay (Lilian Hughes) Carter,44
Mrs. Sam (Leah Rosen) Aks,18
Mrs. George Dennick (Mary Hitchcock) Wick,45
Mr. Peter Denis Daly,51
Mrs. Solomon (Latifa Qurban) Baclini,24
Mr. Raihed Razi,30
Mr. Claus Peter Hansen,41
Mr. Frederick Edward Giles,21
Mrs. Frederick Joel (Margaret Welles Barron) Swift,48
Miss. Dorothy Edith Sage,14
Mr. John William Gill,24
Mrs. (Karolina) Bystrom,42
Miss. Asuncion Duran y More,27
Mr. Washington Augustus II Roebling,31
Mr. Philemon van Melkebeke,23
Master. Harold Theodor Johnson,4
Mr. Cerin Balkic,26
Mrs. Richard Leonard (Sallie Monypeny) Beckwith,47
Mr. Frans Olof Carlsson,33
Mr. Victor Vander Cruyssen,47
Mrs. Samuel (Hannah Wizosky) Abelson,28
Miss. Adele Kiamie Najib,15
Mr. Alfred Ossian Gustafsson,20
Mr. Nedelio Petroff,19
Mr. Kristo Laleff,23
Mrs. Thomas Jr (Lily Alexenia Wilson) Potter,56
Mrs. William (Imanita Parrish Hall) Shelley,25
Mr. Johann Markun,33
Miss. Gerda Ulrika Dahlberg,22
Mr. Frederick James Banfield,28
Mr. Henry Jr Sutehall,25
Mrs. William (Margaret Norton) Rice,39
Rev. Juozas Montvila,27
Miss. Margaret Edith Graham,19
Miss. Catherine Helen Johnston,7
Mr. Karl Howell Behr,26
